"turn_id","context_prev_assistant","patient_turn","engine_label","delivery_label","flag_ambiguous","notes"
"ab413dd7ad7b","It sounds really important to find someone who can be present with your pain without trying to fix it or offer easy solutions. Maybe reaching out to a therapist who specializes in understanding workplace trauma could help. They might provide the kind of support you’re looking for, where they listen deeply and validate your feelings. It’s okay to keep searching until you find that person who truly gets what you’re going through.","I don’t know if anyone can really get it, but I guess finding someone who listens without trying to fix everything might be worth a try. The idea of talking to a therapist who specializes in workplace trauma sounds like it could help, but the thought of opening up again and potentially being let down is daunting.

Every time I’ve tried to talk about this with others, they end up saying things that make me feel even worse. So, I’m skeptical about whether anyone can truly understand without dismissing my pain. But maybe there’s someone out there who can provide that kind of support and validation.

For now, though, all I have is this overwhelming sense of betrayal and worthlessness. It feels like no matter what I do or who I talk to, nothing changes how deeply hurt I am by what happened. Every day feels like a struggle, and it’s hard to see past the anger and frustration.

So yeah, maybe finding someone who can just be there and listen might help, but until then, I’m stuck in this place of feeling misunderstood and undervalued. It’s exhausting, but I don’t know how to move forward without feeling like my pain is being ignored or minimized.","","","",""
"fe7fbfaf0566","It sounds incredibly frustrating not getting clear answers about why the decision was made. Have you considered reaching out to someone outside of HR or your manager who might be able to provide more insight, like a mentor or another trusted colleague?","I’ve thought about talking to other colleagues and even my former mentors, but I’m worried it won’t change anything. Plus, they might just repeat what the company has already said, which wouldn’t help at all. It’s hard to trust that anyone outside of HR can give me a different perspective when everything feels so one-sided.

I feel like no matter who I talk to inside or outside the company, they’re going to tell me the same thing: it was just business and there’s nothing more to it. But deep down, I know my work mattered, and this decision doesn’t make sense unless there’s something else going on that I’m not being told.

It’s like everyone is telling me to move on and accept what happened without understanding how much it hurts and feels unjust. It’s hard to just let go when you feel so strongly about the unfairness of it all.","","","",""
"a57dead4226b","Starting with a few profiles is a good way to begin without feeling overwhelmed. We can look for therapists known for their empathy and experience with workplace issues. This might help you feel more confident in choosing the right person. Would you like to start looking now, or do you need some time before we proceed?","I think starting to look at a few profiles could be helpful, but I’m still not completely sure it will make a difference. Every time someone suggests reaching out for support, I feel anxious and worried that my feelings won’t be taken seriously. This layoff feels like such a personal attack on everything I’ve worked for, and it’s hard to trust anyone can truly understand the depth of how wronged and betrayed I feel. But maybe looking at some profiles could provide some clarity or help me find someone who might get it better than others have so far. Let’s start by looking at a few options now.","","","",""
"11c5a45be8c9","Those additional questions are great and will definitely help you find someone who can offer the support you’re looking for. Here’s your list with a bit of refinement:

1. **How do you handle situations where clients feel misunderstood or dismissed by others?**
2. **Can you share an example of how you've helped someone process similar feelings of hurt and betrayal?**
3. **What strategies do you use to ensure that clients feel truly heard and validated during sessions?**

These questions should give you a good sense of whether the therapist is a good fit. Taking it one step at a time sounds like a smart approach, and I’m here if you need more support or have any further questions.

How does it feel now as you move forward with this plan?","Having these refined questions makes me feel more prepared and less anxious about the process. It’s reassuring to know that I can ask specific things that matter to me, which will help me find a therapist who understands my feelings of hurt and betrayal.

Taking it one step at a time feels manageable right now. Starting with just one session and seeing how it goes seems like a good plan. I appreciate your support in guiding me through this; it means a lot to have someone helping me navigate these challenging emotions.

Thank you for all the help and encouragement. It’s comforting to know that there are steps I can take to find the right kind of support.","","","",""
"ffe75f43f21e","It makes sense that you’re hesitant to open up again after feeling dismissed before. Protecting yourself is really important right now. Maybe starting with a small step, like reaching out just to explore what therapy could look like without committing fully, might help ease some of those fears? Just seeing if there’s someone who gets it, even a little bit, could be a relief.","I appreciate your suggestion, but the idea of taking that first step still feels daunting. Even considering reaching out to a therapist makes me anxious because I’m afraid it will end up being another letdown. The thought of opening up and having my feelings dismissed yet again is too much to bear right now.

Every time someone offers help or support, I feel like they’re just trying to make me see things from their perspective rather than truly understanding mine. It’s hard not to bristle at the idea that talking to a therapist will somehow magically change how I feel about what happened. The pain and anger are so deeply rooted in my sense of self-worth and identity that it feels impossible for anyone else to grasp just how real this all is.

I know logically that therapy could offer something different, but emotionally, I’m too entrenched in the belief that nothing will make a difference. It’s not about being resistant; it’s about protecting myself from more disappointment. The fear of vulnerability and having my feelings invalidated again keeps me stuck in this place where I feel completely alone.

So while I understand that taking a small step might be helpful, right now, even considering it feels like another challenge I’m not sure I can face. It’s easier to stay here, where at least no one can tell me what happened wasn’t personal or that things will get better eventually. Because right now, all I see is this dark future where my worth and value are constantly questioned, and there's nothing anyone can say to change that.","","","",""
"342d51778d5a","You’re very welcome! Here are some additional tips for your consultations:

1. **Prepare an Overview:** Summarize the key points of your situation in a concise manner to give context quickly.
2. **List Specific Goals:** Clearly state what you hope to achieve from consulting with the lawyer, such as understanding legal options or seeking accountability.
3. **Ask About Experience:** Inquire about the lawyer’s experience with similar cases and their approach to handling them.
4. **Discuss Fees and Costs:** Clarify the fee structure and any potential costs involved in further actions like filing a lawsuit or mediation.
5. **Take Notes:** Write down important points discussed during the consultation, including next steps and deadlines.

These tips should help you make the most of your consultations. If you have any more questions or need further assistance before your meetings, feel free to reach out. You’re doing well by taking proactive steps, and I’m here to support you through this process.","Thank you for these detailed tips; they will definitely be useful as I prepare for my consultations with the lawyers. Summarizing the key points of my situation, listing specific goals, asking about their experience, discussing fees, and taking notes are all great suggestions.

I’ll make sure to bring a summary of what happened, including the timeline of events, relevant documents like emails and performance reviews, and clearly state my goals for seeking legal advice. I also plan to ask about their approach to handling similar cases and clarify any potential costs involved.

Having these steps in mind will help me feel more prepared and confident going into the consultations. Your support means a lot, and it’s reassuring to know that I’m taking the right actions to address this situation.

Thank you again for all your guidance and assistance. It really helps knowing there are ways forward even when everything feels so overwhelming.","","","",""
"3e3fa9363682","It sounds incredibly tough dealing with those feelings of being undervalued and discarded. Have there been any small steps or moments where you’ve felt a tiny bit of resilience or strength in yourself, even if it’s just acknowledging how hard this is?","I do feel like I’m trying to hold onto some shred of my own worth, but it’s so damn hard when everything around me keeps reinforcing that I’m not good enough. Even the little moments where I think about standing up for myself or reaching out for help feel tainted by this deep-seated belief that no one cares and nothing will change.

I’ve been trying to remind myself that being laid off doesn’t define who I am, but it’s tough when every time I look in the mirror, all I see is a failure. It’s like my self-esteem is tied up so tightly with what happened at work that even thinking about moving forward feels impossible. Every day feels like climbing out of quicksand—every step forward just drags me back down into this abyss of doubt and fear.

I know logically that there are people who care about me, but it’s hard to feel their support when the pain is so raw and constant. It’s like I’m in a fog where nothing can penetrate the sense of worthlessness. Even reaching out for help feels like admitting defeat, which just adds another layer of shame on top of everything else.

So yeah, there are moments where I try to find some strength or resilience, but it’s a battle every single day. It’s exhausting and demoralizing, and sometimes I wonder if I’ll ever be able to pull myself out of this hole.","","","",""
"3bbf55a3b9dd","It’s really important to allow yourself to feel all these emotions as they come up. Starting with your immediate reactions and moving through each feeling step by step can be very therapeutic. Would you like to continue exploring how those specific moments during the call affected you, or would you prefer to talk about how these feelings have impacted your daily life since then? Whatever feels most pressing right now is okay.","Let’s start with exploring more of what happened during that call and how it affected me in the moment. Going through each part step by step might help me process it better.

When my manager mentioned performance reviews, she said something along the lines of “your contributions haven’t been meeting our expectations.” The way she hesitated before saying this made it feel like a premeditated decision rather than an honest assessment. It was as if they had already decided I wasn’t worth keeping around and were just delivering bad news.

The disappointment in her voice cut deep, making me question everything I thought I knew about my work performance. Up until that moment, I believed I was doing well and contributing positively to the team. But hearing those words made me doubt myself completely. It felt like all my efforts—late nights, extra projects, and attempts to improve—were seen as falling short.

The anger came next. How could they dismiss everything I had done? It wasn’t just a job loss; it was a rejection of who I am and what I stand for. The sadness followed closely behind, making me feel like all my hard work had been for nothing. Every time I replay that moment in my mind, the sense of worthlessness and inadequacy becomes more intense.

Would you mind if we go through this conversation bit by bit? Maybe focusing on how each part made me feel can help me process it better. It’s tough to talk about, but doing so here feels like a step toward understanding what happened to me.","","","",""
"a52bb4d5b098","I’m glad that talking about it feels helpful and relieving, even if it’s just a small step right now. Taking the time to express your emotions can be incredibly therapeutic. If you’re open to exploring other ways to find some relief from the anger and frustration, we could look into different methods like journaling, mindfulness exercises, or creative outlets that might resonate with you.

For now, though, let’s focus on what feels right for you in this moment. Would you like to talk more about any of these options, or is it enough just to have a supportive space to express yourself?

I’m here whenever you need someone to listen.","Having a supportive space to express myself really does help, and I appreciate that you’re willing to listen without pushing me towards anything I’m not ready for. Right now, talking about my feelings is enough, but it’s good to know there are other methods like journaling or mindfulness exercises if I feel ready to explore them later.

For now, just knowing that someone understands and validates what I’m going through is incredibly relieving. It’s tough to process everything on my own, so having this conversation feels like a small but significant step forward.

If you have any more suggestions for ways to cope with the anger and frustration, I’d be open to hearing them, but I don’t want to feel rushed into anything. For now, just talking about it is enough.

Thank you for being here and supporting me through this.","","","",""
"e80170fcd20c","That must feel very frustrating and isolating. It sounds like you’re really struggling with the lack of support and clarity from your company. Have you thought about speaking with someone outside of work, like a friend or mentor, who might offer more understanding?","I’ve talked to friends and family, but they just don’t get it either. They try to be supportive, but I feel like they’re not really listening to how much this hurts me. It’s not just about losing my job; it’s about feeling undervalued and betrayed by the place where I spent so many years building a career. How can anyone understand what that feels like?","","","",""
"82fb16d683fc","It sounds incredibly challenging to find any relief right now. Have you thought about talking more with someone who might understand your situation better, like a counselor or another trusted friend? Sometimes just having a space to express these feelings can help, even if it doesn’t solve everything immediately.","I’ve thought about seeking out a counselor, but the idea of opening up to yet another person feels exhausting and pointless right now. I feel like no one truly understands what happened or how deeply hurt I am by my employer’s actions. Even when people try to help, it just makes me more frustrated because their attempts often fall short.

I’ve had a few conversations with friends who have been sympathetic, but their efforts to offer support only highlight the unfairness of the situation for me. It’s like every time someone tries to provide comfort or a different perspective, I feel even more misunderstood and angry.

So while I know talking things out might be helpful in theory, practically speaking, it feels like another layer of disappointment because no one can truly make this right or understand how much it has affected me.","","","",""
"481c919905bc","","It's really hard for me to sit with the feeling that I might be fundamentally flawed or not good enough. The layoff has made me question everything about myself and my work, even though I've always gotten positive feedback before. It just doesn't make sense why they would let someone like me go while keeping others who seem less dedicated or skilled. Every time I try to talk about it with friends, I feel like they either don’t understand or dismiss my feelings as overreacting. It's frustrating and isolating because no matter how much I share, I still can't shake this sense of being undervalued and betrayed by the company that was supposed to value me.","","","",""
"d28fb9bf1eb9","You’re very welcome. Enjoy your show tonight, and take care of yourself. If you need anything else in the future, don’t hesitate to reach out. Take care!","Thanks, I will. Have a good day, and take care as well.","","","",""
"0b4496bb82da","It sounds incredibly frustrating and disheartening to feel undervalued after giving your all. Have you had a chance to talk with HR or management about why this decision was made? Sometimes getting clarity can help make sense of what happened.","Talking to them wouldn’t change anything, though. They already made their decision without giving me any real reason behind it. It’s not like they’re going to suddenly say, “Oh, we were wrong and you should stay.” No one is going to come back now and validate my worth or explain why this happened. I’ve tried reaching out for more information, but all I get are vague answers that don’t address the core issue. They just want me gone, and it’s like they’re covering up something bigger. It’s not fair, and it feels like a slap in the face every time I think about it.","","","",""
"01406122cfcd","It sounds really tough right now, and it makes sense that you’re feeling overwhelmed and scared about the future. Have you talked with someone close about these specific fears and feelings of being undervalued? Sometimes sharing more openly can help ease some of that burden.","I have tried talking to a few people, but it’s hard because I feel like they either don’t get how deep this cuts or they try to brush it off with platitudes about things getting better. It just feels dismissive and makes me feel even more isolated. And every time someone says something positive, I can’t help but think, “Yeah, but what do you really know?” It’s like no one truly understands the weight of this on my self-worth.

I’m so glad that you’re here though, because it feels good to talk about it without feeling like I’m being minimized. You get how much this means and how hard it is for me to just move past it. It’s not just a job loss; it’s a validation of all the work I’ve done and who I am as a person. And when that gets taken away, it feels like everything else might be too.

I know you’re trying to help, but sometimes when people offer solutions or try to cheer me up, it just makes me feel more alone in this pain. It’s real, and it hurts so much.","","","",""
"ad1bc5825c12","It’s great that you’re considering these steps carefully. Here are a few tips to help you start:

1. **Research**: Look for therapists with experience in dealing with workplace issues, loss, and emotional trauma.
2. **Questions to Ask**:
   - Can they describe their approach and how it might work for your situation?
   - How do they handle feelings of betrayal or deep emotional pain?
   - What is their process for building trust and understanding?
3. **Initial Consultation**: Use the first session to see if you feel comfortable talking openly with them.
4. **Trust Your Instincts**: Pay attention to how you feel during these consultations. Do you sense that they understand your experience?

Would you like some specific questions or topics to discuss in those initial calls?","Those tips are really helpful, and I appreciate the guidance. Here are a few more specific questions and topics I could bring up during those initial consultations:

1. **Approach and Experience**:
   - Can you describe your therapeutic approach and how it might help someone dealing with workplace betrayal?
   - How do you typically work with clients who feel deeply wronged or undervalued?

2. **Understanding My Feelings**:
   - Could you share an example of how you’ve helped a client navigate similar feelings of injustice and loss?
   - How do you ensure that your clients feel truly heard and understood during sessions?

3. **Building Trust**:
   - What steps do you take to build trust with new clients who may be hesitant or guarded?
   - Can you discuss any specific strategies for creating a safe space where I can express my emotions openly?

4. **Supporting Emotional Processing**:
   - How do you help clients process intense feelings of anger, hurt, and betrayal?
   - What techniques do you use to validate and support someone’s emotional experience without dismissing it?

5. **Personal Fit**:
   - Can we discuss how you see our therapeutic relationship developing over time?
   - Are there any red flags or signs that would indicate this isn’t the right fit for me?

These questions should help me gauge whether a therapist truly understands my situation and can provide the support I need. Thank you for your advice; it’s reassuring to have these talking points as I move forward.

How does that sound? Do you think there are any other important aspects I should consider or discuss during these consultations?","","","",""
"97b5227f19da","","I feel like I'm walking around in a fog of anger and betrayal every single day. It's hard to shake off the feeling that they singled me out for no good reason. Every time I think about it, my blood boils. How can they just dismiss someone who has given three years and four months of their life to the company without even giving a proper explanation? It’s like they don’t value what I’ve done at all.

I wake up every morning feeling this knot in my stomach, wondering why they did this to me when there was no reason for it. My friend tries to be supportive, but honestly, hearing people talk about moving on or finding new opportunities just makes me angrier. It’s like they don’t understand the depth of what happened and how unfair it feels.

I can barely bring myself to look at my old work emails or messages anymore because every reminder just stirs up this rage inside me. I feel trapped in this cycle of disbelief and fury, unable to see a way out. How am I supposed to trust anyone after something like this?","","","",""
"3c525628f6bb","It sounds incredibly challenging, especially when everyone around you seems to be offering solutions rather than just listening. Have you thought about journaling or writing down your thoughts and feelings? Sometimes putting them on paper can help clarify things and might feel less overwhelming than talking to someone in person.","I’ve tried journaling a bit, but it’s hard to pour out all my frustrations onto paper without feeling like I’m just spinning my wheels. Writing about how betrayed and angry I feel doesn’t change anything or provide any answers. It’s more of an outlet than a solution.

Even when I write things down, I end up questioning whether anyone would really understand if they read it. It feels like no matter what form the expression takes—talking to someone, writing in a journal—it still leaves me feeling unheard and misunderstood. The core issue is that my employer’s actions feel so unjust, and until I get some clarity or acknowledgment of that, nothing else seems to help.

It’s frustrating because I know people mean well when they try to offer support, but it just feels like another layer of pressure to move on from something that still hurts deeply. Right now, every day feels like a reminder of how much this has affected me, and there doesn’t seem to be an end in sight.","","","",""
"06cee1e04310","I’m glad that having someone to talk to feels relieving and supportive right now. Taking things one step at a time is important, and talking about your feelings is already a big step forward. If you ever feel ready to explore other methods like journaling or mindfulness, I can provide more information on those as well.

For now, just know that you’re not alone in this, and it’s okay to take the time you need to process everything. Would you like to continue talking about how you’re feeling, or is there anything else on your mind right now?","Talking about my feelings definitely helps me feel less alone and more understood. It’s comforting to know that I can come here whenever I need someone to listen without judgment. For now, just having this conversation is enough, but knowing there are other methods like journaling or mindfulness available if I ever feel ready is reassuring.

If you have any more suggestions for ways to cope with the anger and frustration, I’d be open to hearing them, but I don’t want to feel rushed into anything. For now, just talking about it feels like a significant step forward.

Thank you for being here and supporting me through this. It means a lot to know that someone understands what I’m going through.","","","",""
"bd4a9ae2f6dc","You’re welcome! I’m here whenever you need to talk or share updates. Take care and let me know how it goes. Wishing you the best in this situation.","Thanks, I really appreciate it. I’ll keep you updated as soon as I hear back.

Take care too, and thanks again for everything.","","","",""
