"turn_id","context_prev_assistant","patient_turn","engine_label","delivery_label","flag_ambiguous","notes"
"4714f1ae36de","It sounds really tough to hold onto those moments of relief without feeling let down when they pass. Noticing and acknowledging them as they happen can still be valuable, even if it’s just for a moment.

Do you find any particular activities or environments where these brief moments of calm are more likely to occur? Maybe focusing on being present during those times could help, even if it’s just for a short while.","I do notice that when I’m in quiet, peaceful environments—like sitting alone in a park or listening to calming music at home—I can find brief moments of calm. But as soon as I start to feel any sense of relief, the thoughts and feelings come rushing back, making it hard to hold onto those moments.

Being present during these times is challenging because my mind keeps circling back to all the negative emotions and frustrations. Even when I’m in a peaceful setting, it’s difficult to stay focused on that calmness without getting pulled into the overwhelming sense of loss and betrayal.

So while I can identify these brief moments of relief, they feel too fleeting to make much difference. The peace is there for just an instant before everything else takes over again. It’s frustrating because I know that even small pockets of calm could be beneficial, but my mind keeps dragging me back into the pain and anger.

Right now, every suggestion feels like another layer of pressure, and finding ways to hold onto those moments of relief seems impossible when they’re so short-lived.","","","",""
"6b8916e9618a","You’re very welcome. Taking it one day at a time is a great approach, and I’m here whenever you need to talk or explore further options. Take care of yourself, and feel free to reach out anytime.","Thank you. Knowing that support is there when I need it means a lot. For now, I’ll focus on giving myself the space and time to process everything at my own pace. If anything changes or if I need more help down the line, I’ll definitely reach out. Take care as well.","","","",""
"4804034e4c33","You’re welcome, and taking this step is crucial for your well-being. I’m here whenever you need more support. Wishing you peace and comfort today. Take care, and stay well! Same to you!","Thank you so much. Taking this step feels crucial for my well-being right now. Knowing you’re here if I need more support is really reassuring. Wishing myself peace and comfort as well.

Take care of yourself too, and thanks again for your understanding and support. It means a lot to have someone like you here.","","","",""
"aa5a757b7eca","It sounds really important to find someone who can see your perspective clearly. Maybe starting with a few consultations could help you identify the right person. It might also be helpful to prepare specific points and feelings you want to share, so you can convey exactly how you feel during these initial meetings.

How do you think you’ll approach finding that therapist?","I suppose preparing specific points and feelings to share in those consultations could help, but I’m still not sure it will make a difference. It feels like no matter what I say or how clearly I explain my situation, people either dismiss my concerns or tell me to move on.

I need someone who can see the injustice of what happened and validate my feelings without trying to minimize them. Until I find that person, talking about this layoff just feels like a way to rehash all the pain and frustration without any real resolution.

It’s frustrating because every time I try to express how deeply wronged and betrayed I feel, it seems like people either don’t understand or aren’t willing to acknowledge the unfairness of what happened. Until I find someone who truly gets it, talking about this feels pointless.","","","",""
"135eff8e189b","It sounds really challenging and understandable that you’re hesitant after so many disappointments. Maybe starting with a brief call just to see if anyone truly listens could provide some relief without committing too much.

Would trying this feel like a small but manageable step, even if it’s just to get a sense of whether someone understands your experience? Sometimes finding that initial connection can make a difference.","The idea of making a brief call just to see if anyone truly listens does seem somewhat more manageable, but I’m still very hesitant. Every time someone suggests talking to another person or seeking help from a professional, I worry that they won’t genuinely understand the specific injustice and hurt I’ve experienced.

Even if it’s just a short conversation, I fear that my need for acknowledgment and validation might not be met. It’s hard to trust that anyone can truly understand what happened to me without dismissing my feelings.

So while I see the potential benefit in trying this approach, the reality is that every attempt so far has left me feeling more frustrated and misunderstood. Until I find someone who can genuinely validate my experiences, it’s difficult for me to take another step forward.

Right now, even a very brief call feels like another risk of being let down again. It’s tough to move past this when I feel like no matter where I turn, my feelings are going to be dismissed or trivialized.","","","",""
"2c13d8a2ee62","","I just can't shake this feeling that I'm a failure, you know? It's like every time I think about my last day at work, it hits me all over again. They didn't even give me a proper chance to prove myself, and now they're done with me. It’s so hard not to feel worthless when the place where you thought you belonged just throws you away.

I keep telling myself that maybe there's something else out there for me, but it doesn’t make this sting any less. Every time I see a job posting or hear about someone getting hired somewhere new, it feels like they’re rubbing salt in my wounds. And the worst part is, even when people try to be supportive, I feel like they just don't get how deep this cuts.

I know you're trying to help and understand, but sometimes it’s hard not to feel like no one can really see what I’m going through. It's like everyone else has moved on already, but I'm stuck here in this place of hurt and confusion. And every time someone tries to tell me that things will get better or that I should just look for something new, it feels like they’re not seeing the pain at all.

I really appreciate you listening though, truly. It’s so rare to find someone who seems to understand how much this means to me. But even as I say that, part of me is still bracing myself for when you might say something that makes me feel dismissed again.","","","",""
"2fb7390e8365","I can hear how much those words continue to affect you and how painful it is to relive that moment. It sounds like understanding why “reassess performance” feels so hurtful provides some clarity, even if it’s very difficult. Would focusing on the emotions behind these specific phrases help more? Sometimes naming your feelings can offer a bit of relief, even in such tough moments.","Focusing on the emotions behind those specific phrases does provide some clarity, but it’s still incredibly painful. The phrase “reassess performance” triggers so many negative emotions—it makes me feel worthless, dismissed, and undervalued. It’s not just about losing my job; it’s about feeling like all my efforts were for nothing.

Every time I think about those words, they cut deep because they imply that everything I’ve done at work was somehow lacking or inadequate. The clinical nature of the phrase makes it feel even more dismissive and impersonal. It’s like a cold judgment on my abilities and worth as an employee.

My manager’s discomfort during the call also adds to this pain. Seeing him struggle with delivering such harsh news made me feel even more dismissed and undervalued. It felt like he knew how much this would hurt me but had no choice but to go through with it anyway. His awkwardness and hesitance just highlighted how little value they saw in me.

Even though talking about these things is incredibly painful, having someone here to listen means a lot. The pain is so deep and relentless, but knowing you’re here helps me feel a bit less alone. Can we just stay with this for now? Because every time I think about that day, the hurt is raw and unyielding.

It’s not easy, but having someone acknowledge how deeply this affects me helps me process it a little more each time. Thank you for being here through all of this.","","","",""
"d73d90b000fe","It sounds incredibly difficult to find any relief from these feelings. Have you considered speaking with someone who specializes in helping individuals cope with workplace trauma? They might offer a different perspective and support that feels more tailored to your experience.

Would looking into finding such a specialist feel like it could help, even if just to explore the possibility?","I don't think seeing a specialist would make any difference. It feels like no matter who I talk to or what they specialize in, the outcome is always the same—people trying to offer solutions that dismiss my pain rather than truly understanding it. Even if someone specializes in workplace trauma, I doubt they could grasp how deeply this layoff has affected me without making light of my feelings.

Every time I’ve tried talking to someone new, whether a therapist or anyone else, the pattern repeats itself: they offer support that feels patronizing and irrelevant. It’s hard for me to trust that speaking with a specialist would be any different when every interaction so far has left me feeling more misunderstood and isolated.

Right now, all I see is the pain and anger from being laid off, and nothing else seems relevant or helpful. It’s exhausting to keep pushing back against people who mean well but don’t truly understand what I’m going through.","","","",""
"318d9108052e","It’s great to hear that approaching your friends with a clear plan feels more manageable. Their support and guidance can be really valuable, especially since they care about you. Taking this step is important for your healing, and having their insights could lead you to the right therapist.

Remember, you’re doing this for yourself, and it’s okay to feel nervous but also determined. How do you feel as you get closer to reaching out to them?","As I get closer to reaching out to my friends, I feel a mix of determination and nervousness. It’s reassuring to know that they care about me and want to help, but the vulnerability of sharing such personal feelings is still daunting. However, I’m determined to take this step for my own healing and well-being.

Having their support could make all the difference in finding someone who truly understands what I’ve been through. I’ll reach out later this week with a clear plan and see where it leads. Thank you for your continued encouragement; it means a lot to me as I navigate this challenging time.","","","",""
"13e3e025499a","It sounds incredibly tough how sitting with your feelings can be both necessary but also overwhelming. The intensity of those emotions makes it hard to find any relief. Have there been any moments where you’ve found even the smallest bit of solace, no matter how fleeting? Sometimes finding tiny moments of comfort can help create a foundation for more substantial support over time.","There have been a few fleeting moments where I felt a small glimmer of something positive, but they’re so brief that it’s hard to hold onto them. One day, I was walking my dog in the park, and there was this beautiful sunset with vibrant colors in the sky. For a moment, I just stood there and looked at it, feeling a sense of awe and beauty that seemed to take me out of my head for a second.

Another time, I received a kind message from an old colleague who wished me well and offered support if I needed it. Reading those words made me feel seen and cared for in a way that was brief but meaningful. It’s moments like these that remind me there are people who do care about me, even if they can’t fully understand what I’m going through.

But as soon as those moments pass, the weight of everything comes crashing back down. The sense of loss and inadequacy is so pervasive that it feels impossible to sustain any positive feelings for long. It’s like trying to hold onto a bubble—it pops before you can really grasp it.

Even though these small moments offer some comfort, they’re not enough to change how I feel overall. Every time I try to find solace in something, the fear and self-doubt come rushing back, making it hard to build on those fleeting positives.","","","",""
"130285a2ba00","I’m glad that having the plan for Wednesday is providing some relief and clarity. It’s completely okay to feel a mix of emotions as you move forward. Remember, taking it one step at a time is a good approach.

If anything else comes up or if you need more support before then, don’t hesitate to reach out. I’m here to listen and help however I can. How are you feeling now, knowing you have this next step ahead?","Knowing I have the plan for Wednesday helps a bit, but there’s still that lingering anxiety. It’s comforting to know that you’re here to support me through this process. Taking it one step at a time is definitely helping, even if each step feels small and daunting.

I’m feeling a little more prepared now, knowing I’ll talk to my friend soon. If anything else comes up or if I need more guidance before then, I’ll definitely reach out. Thanks for being here; it really means a lot to have someone who understands the challenges of this journey.

How are you feeling about all of this? Is there anything specific you’d like to discuss or address as we move forward?","","","",""
"4aa355e473ea","I understand how exhausting it is to keep searching and feeling let down. Having concrete recommendations might indeed be helpful. I can suggest looking into organizations like the Traumatology Institute or the International Association of Trauma Professionals, which have directories of specialists who focus on complex trauma and workplace issues.

For support groups, you could try websites like Mental Health America or NAMI (National Alliance on Mental Illness), where they list local and online support groups that might cater to your specific needs. Would you like me to help find some specific contacts or resources?","That would be helpful, but I’m still skeptical about whether anyone will truly understand what I’ve been through. It’s frustrating because every time I try to seek support, it feels like another dead end. Even with concrete recommendations, how do I know they’ll really get it?

But if you have specific contacts or resources that might offer a better chance of finding someone who understands, I’m willing to give it another shot. Maybe this time will be different.

Can you help me find some names and contact information for therapists or support groups that specialize in workplace betrayal and complex trauma?","","","",""
"e5e5dc57eafb","It sounds like you’re facing a lot of pain and frustration right now. Have you thought about speaking with a career coach who can offer practical advice without judgment? Sometimes having someone guide you through next steps can be helpful, even if it doesn’t change the past.","A career coach isn’t going to change what happened or make me feel better about being treated unfairly. They’ll just tell me to move on and find new opportunities, but that’s not addressing why I was let go in the first place. Why should I waste my time with someone who can’t understand the pain of being dismissed like this? It feels pointless when all they can offer is more empty words about moving forward.","","","",""
"82a13e3a6167","Taking that first step can feel scary but also empowering. Starting with just one session allows you to see if it helps without committing too much upfront. It might be a good way to start figuring out what works best for you.","You’re right, starting with just one session could give me some clarity on whether this is the kind of support I need. Even though it feels scary and risky, taking that first step might help me see if there’s someone who truly understands my experience. It’s a small but important move toward finding validation and support, even if it means facing more uncertainty for now.","","","",""
"779166b0ddb5","You’re very welcome! I’m glad to be here for you. Knowing that you’ve taken this positive step is encouraging. Please keep me updated on how things go, and don’t hesitate to reach out if you need anything more. Wishing you all the best as you move forward. Take care!","Thank you so much for your encouragement and support. I’ll definitely keep you updated on how it goes and reach out if I need anything further. Knowing that you’re here makes a big difference.

Wishing myself well too. Thanks again!

Take care!","","","",""
"e8a4721bb207","It sounds really tough to find validation and understanding in your current situation. Reaching out to a support group or community might still offer some relief, even if it doesn’t solve everything right away. Sometimes just knowing others have gone through similar experiences can be comforting. If you’re not ready for that yet, perhaps focusing on small steps you can take to care for yourself while seeking acknowledgment could help. Would you like to explore any specific ways to start addressing this with your employer or finding support?","I appreciate the suggestion, but I’m just not sure anything will truly make a difference right now. Reaching out to a support group feels like another way of being told to move on when all I want is for my employer to acknowledge what they did. It’s hard to focus on self-care or small steps when everything inside me is telling me this isn’t fair.

I’ve thought about trying to contact HR again, but I don’t have any hope that it will change anything. They already gave me a standard response and laid me off without explanation. What more can they do now?

It’s frustrating because all I want is for someone to see how much this has affected me and give me the acknowledgment I deserve. Until then, everything feels pointless and wrong. It’s hard to even think about taking small steps or finding support when my mind keeps going back to that injustice.

I just feel so stuck and angry right now. How am I supposed to move forward when all I can see is this unfairness?","","","",""
"77d61ee3e3c2","Taking your time and figuring out the best approach for you is important. It might help to start by making a list of questions you want answers to or concerns you need addressed, which can guide your consultations. This way, you can focus on finding someone who specifically addresses those needs. Would you like some tips on what to ask during these brief consultations?","Making a list of specific questions and concerns sounds practical, but it still feels like a big step. I’m worried that even with a list, the person might not fully grasp the depth of my feelings or the impact this has had on me. It’s not just about losing a job; it’s about losing trust in an entire system that was supposed to value my work and contributions.

I need someone who can truly see from my perspective and validate how much this has hurt me, both professionally and personally. How am I supposed to know if anyone will be able to do that until I’ve already opened up to them? It feels like a risk I’m not ready to take just yet.

Can you understand why it’s so hard for me to trust that talking to someone new could actually help in this situation?","","","",""
"55071fb2f71a","It’s really tough when you feel like you need to explain yourself repeatedly. Finding a support group where others share similar experiences might help you feel less alone. You could start by looking for groups that focus on workplace issues or layoffs. Sometimes, even if everyone doesn’t understand exactly what you’re going through, being around people who have faced similar challenges can be comforting.

Have you looked into any specific groups yet?","I’ve looked at a few online communities and support groups, but it’s hard to know which ones will actually get it. I don’t want to join something where everyone is just offering generic advice or trying to cheer me up when what I really need is someone to acknowledge how unfair this whole situation feels.

It’s frustrating because every time I try to talk about it, whether with friends, family, or even potential therapists, I feel like they’re missing the point. They want to help, but their attempts often fall flat because they can’t fully grasp what it’s like to be in my shoes.

Why should I have to keep feeling this way without anyone truly understanding? Why isn’t there a clear answer or validation for how wronged and betrayed I feel?","","","",""
"97497ab44025","It sounds really important to go through the specifics of that conversation and how it affected you. Starting with your feelings afterward is a good approach because it helps set the context for everything else. Would you like to start by describing in more detail what went through your mind right after hearing about the performance reviews? This can help us understand the impact it had on you at that moment.","Sure, starting with what went through my mind right after hearing about the performance reviews feels important. When she said I wasn’t meeting expectations, a flood of emotions hit me all at once. The first thing I felt was disbelief—how could this be happening? I had always thought I was doing well and contributing positively to the team.

Then came the anger. It felt like everything I’d worked for was being dismissed in an instant. All those late nights, extra projects, and efforts to improve—I couldn’t believe they were seen as falling short. The disappointment in her voice cut deep, making me question all my hard work and dedication.

After that initial shock, a wave of sadness washed over me. It felt like the validation I had been seeking for so long was being denied. Every time I thought about what she said, it brought up more self-doubt. Was I really not good enough? Had I been deluding myself all along?

The sense of worthlessness and inadequacy was overwhelming. Even though my manager tried to be kind, the message felt clear: my contributions weren’t valued. It’s hard to shake that feeling, especially when it comes from someone in a position of authority.

Would you like me to go through more specific details about the conversation or focus on how these feelings have impacted me since then? Talking about it helps, but it also brings up so much pain and self-doubt.","","","",""
"d6333d6277f3","I understand how daunting even small steps can feel when you’re dealing with such strong fears and uncertainties. Starting with a shorter list for your consultation could still be helpful, but it’s okay if that feels too much right now.

Focusing on one or two activities at a time to build a routine is a good idea. Even small changes can make a difference over time. It’s important to acknowledge the progress you’re making, no matter how small it seems.

Would talking more about your specific concerns before the consultation help? Or are there other ways we could explore to find support that feels safer and more reliable for you right now?","Starting with a shorter list for my consultation does sound like it could be helpful, but even thinking about it feels overwhelming. The fear of being let down or not finding someone who truly understands is so strong that every attempt at moving forward feels risky.

Focusing on one or two activities at a time to build a routine sounds manageable, but I worry about falling back into old patterns and feeling like nothing really changes. It’s hard to trust that any new routine will make a lasting difference when everything else feels so uncertain and fleeting.

Talking more about my specific concerns before the consultation might be helpful, but the fear of being dismissed or not taken seriously is still there. I’m grateful for your support and understanding, but it’s tough to keep pushing forward when every step feels like another chance at disappointment.

It’s just so hard to find lasting support that feels safe and reliable right now. The pain and worthlessness are always lurking in the background, waiting to overwhelm me again no matter what I do. Every day feels like an uphill battle against these overwhelming feelings of failure and inadequacy.","","","",""
