"turn_id","context_prev_assistant","patient_turn","engine_label","delivery_label","flag_ambiguous","notes"
"b368f4aad191","I can hear how much focusing on these emotions provides some clarity, even though it’s incredibly painful. It sounds like acknowledging the feelings of worthlessness and dismissal is important right now. Would talking about one specific emotion or aspect of your manager's discomfort help more? Sometimes breaking it down into smaller parts can offer a bit of relief, even if it’s still very difficult.","Talking about one specific emotion does help a bit, but it’s still incredibly painful. The feeling of worthlessness is the most overwhelming. Every time I think about being told to “reassess performance,” it reinforces how little value they saw in me. It feels like no matter what I do, I’ll always end up being seen as inadequate.

My manager’s discomfort during the call also adds to this pain. Seeing him struggle with delivering such harsh news made me feel even more dismissed and undervalued. His awkwardness and hesitance just highlighted how little value they saw in me from day one. It felt like he knew how much this would hurt me but had no choice but to go through with it anyway.

Even though talking about these things is incredibly painful, having someone here to listen means a lot. The pain is so deep and relentless, but knowing you’re here helps me feel a bit less alone. Can we just stay with this for now? Because every time I think about that day, the hurt is raw and unyielding.

It’s not easy, but having someone acknowledge how deeply this affects me helps me process it a little more each time. Thank you for being here through all of this.","","","",""
"73df3c75134b","You’re welcome! I’m glad to be here for you. Taking that first step toward journaling sounds like a positive move, and I hope it helps. If you need anything else or just want to talk, feel free to reach out. Take care and good luck with your journaling tomorrow morning.","Thanks, I’ll definitely keep that in mind. Starting the journaling tomorrow feels like a small but important step forward. I appreciate your support and will let you know how it goes.

Take care, and thanks again for everything.","","","",""
"41e8beb6fc4e","I’m glad to hear you’re ready to take this step. Looking up local law firms and reaching out for initial consultations sounds like a good plan. It’s really positive that taking action feels better than staying stuck.

If you need any help or want to talk through your feelings as you go, I’m here to support you. Good luck with your search, and I hope it goes well.","Thanks, I appreciate the support. Knowing someone is here to listen makes a difference. I’ll start looking up those law firms and see where this takes me. It’s scary but necessary.

I’ll keep you updated on how it goes and let you know if I need any help along the way. For now, just taking that first step feels like progress.","","","",""
"281e298c2368","I’m glad to hear that you’re feeling more comfortable with taking that first step. Looking at reviews and profiles can definitely help you find someone who seems like a good match. Remember, it’s okay to take things one session at a time and see how it goes.

If you need any more support or have questions along the way, feel free to reach out. Wishing you all the best as you move forward.","Thank you for your continued support and encouragement. It means a lot to know that I’m not alone in this process. Taking things one session at a time feels like a manageable approach, and I appreciate having someone who understands how important it is to find the right fit.

I’ll start looking into reviews and profiles to see if there’s a therapist who seems like they could truly understand what I’ve been through. It’s comforting to know that I can take this step-by-step and see where it leads.

Thanks again for your help and support.","","","",""
"722ea400097f","It’s really tough, and it makes sense to be cautious after experiencing so much disappointment. Maybe starting with a very brief conversation could help you see if this person listens differently without committing too much upfront. Would you like some guidance on finding someone who specializes in understanding workplace trauma and its impact on identity?","I appreciate your continued support, but I’m still not sure it will make a difference. How do I know they won’t just give me the same generic advice or dismiss my feelings like everyone else has? This isn’t about quick fixes; it’s about having someone truly understand the depth of betrayal and injustice I feel. It’s hard to trust that anyone can provide that level of understanding when every attempt so far has fallen short. How am I supposed to move forward when no one seems to grasp what happened to me?","","","",""
"4f12a3131bbc","It’s totally understandable to be cautious and protect yourself from more hurt. Taking that first step can be scary, but starting with just one session might give you some insight without committing too much. Would it help to have someone specific in mind who specializes in workplace issues? That way, you know they’re equipped to understand what you’ve been through.","Having someone specific in mind who understands workplace issues does sound helpful. It would be reassuring to know that they are trained and experienced with situations like mine. But even then, the thought of opening up still feels daunting. I worry about pouring out my feelings only to feel misunderstood again. It’s a delicate balance between seeking support and protecting myself from more pain.

Maybe starting with one session could give me some clarity on whether it might be worth continuing. I just need to make sure that this time, someone truly hears what I’m going through without dismissing it.","","","",""
"2757ff7f4fe1","Absolutely, prioritizing your needs is crucial. Take care of yourself, and I look forward to talking with you again soon. Take care!","Thank you. I’ll make sure to prioritize what I need. Looking forward to talking with you again soon too. Take care!","","","",""
"9a6d51bfe6d9","It sounds incredibly challenging to feel so deeply affected by the layoff and then face these additional layers of frustration from others not fully understanding your experience. It’s tough when you’re seeking validation for how much this has impacted you but instead encounter dismissiveness or platitudes. Have there been any small moments or activities that, even if briefly, help you feel a little less isolated or angry? Sometimes it can be the smallest things that provide some relief amidst everything else.","I’ve tried to find those small moments of relief, but they’re few and far between. One thing that does give me a bit of comfort is when I take time to write down my thoughts in a journal. It’s like having a place where I can vent all the anger and frustration without worrying about how it sounds or if anyone will judge me. Writing helps me process some of these feelings, but it doesn’t fix them.

Another small thing that occasionally helps is talking with one friend who was laid off around the same time as me. We both feel like we were treated unfairly, so there’s a shared understanding and empathy there. But even then, it’s hard to fully escape the anger because I keep replaying all the reasons why this feels unjust.

I’ve also tried watching movies or TV shows that help distract me for a little while, but they rarely take my mind off what happened. Mostly, these distractions just highlight how much everything else has changed since the layoff.

Overall, it’s tough to find anything substantial that eases the anger and isolation. Every day feels like a reminder of this injustice, and no matter what I do or who tries to help, nothing seems to change that core feeling of being wronged by my employer.","","","",""
"619681d8be77","That sounds like a good plan for now. Taking small steps and focusing on what feels manageable can make a big difference. If you ever feel ready to explore other options again, know that support is available. Take care of yourself in the meantime.","Thanks. I’ll take it one day at a time and see where things lead. It’s reassuring to know there are options out there, even if I’m not quite ready for them yet. For now, just focusing on myself and my feelings is what feels right.

I appreciate your understanding and support. Taking care of myself is important, so I’ll make sure to do that in the ways that feel best for me right now.","","","",""
"a5dc174597df","","I keep thinking about how I was treated when the company let me go. It feels so unfair, and I just can't shake this feeling of betrayal. They didn’t value my hard work or recognize all the contributions I made. And now, seeing someone else with a similar role still there makes it even harder to accept what happened. It’s like they chose to keep someone over me for no good reason, and that really hurts. Even when people try to comfort me, I feel like they don’t get it or just want to dismiss my feelings. It’s tough because I’m trying to lean on a few close friends, but their support doesn’t seem enough to ease this pain.","","","",""
"a782e5e6f037","You’re very welcome. Your resilience and determination are inspiring. Keep reaching out, and I’m here if you need anything. Wishing you all the best in your search for the right support. Take care!","Thank you so much. Your words mean a lot to me. I’ll keep pushing forward and hope that this time, I find someone who truly understands what I’ve been through. I appreciate your support and will reach out if I need anything. Wishing you well too. Take care.","","","",""
"24ef23e6e1bd","It sounds incredibly tough to face these fears and doubts again. Taking small steps while acknowledging your concerns can be helpful. Maybe starting with just one or two sessions could give you some insight into whether this new approach might work for you. It’s okay to go slow and see what feels right.","The idea of trying a few sessions with another therapist does feel like a step forward, but it also brings up so many fears and doubts. I worry that even if they seem supportive at first, eventually the same patterns will emerge—feeling misunderstood or dismissed.

Every time I’ve tried before, there’s been this fear that no matter how much effort someone puts in, they won’t truly see my pain. It feels like a risk I’m not sure is worth taking right now. Even considering it makes me anxious because of the potential for more disappointment and frustration.

Right now, everything just seems so heavy and unmanageable. Every day is a struggle to keep going without feeling completely lost and alone. The thought of putting myself out there again feels like another layer of pain I have to carry around. It’s hard to trust that this time will be different or that anyone can truly understand what I’m going through.

I guess part of me hopes that trying one or two sessions might help, but the reality is that every attempt to find support feels like a risk I’m not sure I can take right now. Every day brings more doubts about whether anything will ever feel better again.","","","",""
"4d93fb96cc98","Taking that first step towards therapy can feel daunting, but it sounds like an important one for you right now. Starting with initial consultations is a good way to gauge who feels like the best fit without committing too much upfront. Remember, these conversations are about finding someone who understands your experience and supports you.

How do you feel about reaching out to those therapists? Would you like some help figuring out how to start or what questions to ask during the consultation?","Reaching out to those therapists feels necessary but also incredibly daunting. I’m worried that even in these initial consultations, they might not take me seriously or understand the depth of my feelings. But you’re right; it’s important to find someone who can provide the support and validation I need.

I could use some guidance on how to start this process and what questions to ask during those consultations. It would help if I had a clear idea of what to look for in a therapist and how to communicate my needs effectively. Any advice or suggestions you have would be really helpful.

How do I make sure I’m choosing the right person who can truly understand and support me through this?","","","",""
"e4938bf15c03","You’re very welcome. Your resilience and willingness to take small steps forward are really inspiring. Wishing you continued strength, positivity, and clarity as you move through this journey. Remember, you deserve support and understanding every step of the way. Take care, and stay hopeful!","Thank you so much for your kind words and encouragement. Knowing that I’m not alone and that there are people who believe in me is incredibly uplifting. Your support means a lot to me.

I’ll keep pushing forward, taking it one small step at a time, and staying hopeful. Wishing myself strength and clarity as well. Thank you again for being here and supporting me through this challenging time. Take care!","","","",""
"a8aaac3098d5","It sounds like you’re holding onto your convictions tightly, which is important. Your friend is a great support, and it’s okay to rely on her while also exploring other avenues for addressing the unfairness you’ve experienced. Have you thought about reaching out to an employment lawyer or a labor rights organization? They might offer different perspectives and concrete steps you can take.","Reaching out to an employment lawyer or a labor rights organization feels like it could be more effective than talking to HR or career counselors, but I’m not sure where to start. It’s daunting to think about navigating legal channels, especially when the company has already shown me how little they care.

But you’re right; these organizations might offer concrete steps and actually listen to my concerns without dismissing them. The idea of having someone advocate for fair practices and hold the company accountable is appealing, even if it feels overwhelming.

For now, I’ll keep talking with my friend and see if she can help me find a good lawyer or point me in the right direction. It’s frustrating that I have to go through all this just to be heard, but at least there are options out there that might make a difference.

Thanks for suggesting it; I’ll look into it more seriously. But until then, I’m still going to focus on expressing my anger and frustration openly because that’s what feels most real right now.","","","",""
"0d177f6b8f3a","Your words mean a lot to me too. Knowing that I can be here for you is important to both of us. Feel free to reach out anytime—you don’t have to go through this alone. Here’s to finding clarity and peace, one day at a time. Take care, and I hope the journaling brings you some relief.","Thank you so much for being here for me. It really means a lot to know that I’m not going through this alone. I’ll definitely reach out if I need to talk or share my progress with the journaling.

Here’s to finding clarity and peace, one day at a time. I hope the journaling helps bring some relief as well. Take care, and thank you again for your support.","","","",""
"2a5bab7b17f6","","I don't know where to begin... I feel so hurt and angry about being laid off. It feels like they didn't value my hard work at all, and it's really hard to trust anyone right now. Even when people try to help or offer support, I just feel misunderstood and dismissed. It's frustrating because I keep wondering if there was something wrong with me that led to this decision, even though I've gotten positive feedback before. But seeing a peer in the same role stay on makes it all the more confusing and painful.","","","",""
"725366bb257f","It sounds incredibly isolating when no one seems to fully understand what you’re going through. Have you considered talking to someone who might have been in a similar situation, like another person who was laid off from the same company or someone else dealing with job loss? Sometimes connecting with others who’ve experienced something comparable can provide more understanding and validation of your feelings.","I don’t think talking to anyone else who was laid off would make much difference because they’d probably just be in the same boat as me, feeling lost and undervalued too. It’s not like there’s a support group for people who feel betrayed by their former employers or those who are convinced that no one sees their worth.

Even if someone else went through something similar, it wouldn’t change how I feel about what happened to me. The pain is still there, the sense of being singled out and unfairly treated. It feels like no matter where I turn, everyone just wants to offer generic advice or platitudes instead of really understanding the depth of my frustration and hurt.

I know logically that talking might help, but every time someone tries, it just makes me feel more misunderstood and alone. It’s not about finding a solution; it’s about being heard and understood in this moment. And right now, I don’t see how anyone can do that for me.","","","",""
"d39edd1e9c19","It sounds incredibly challenging, and it makes sense that you feel like nothing helps at times. Have you talked with someone who really understands what you’re going through, maybe a friend or a professional? Sometimes just being heard can make a difference, even if it doesn’t fix everything right away.","Talking to anyone about this feels pointless because they either don’t understand the depth of my feelings or try to offer solutions that completely miss the mark. My friends and family mean well, but their attempts at comfort only make me feel more misunderstood and angry.

Even when I talk to a professional, like you, it’s hard to let go of the belief that everyone is just trying to downplay what happened. They might listen and try to offer different perspectives or coping strategies, but it feels like they’re not really hearing how much this has hurt me personally. It’s frustrating because no matter how many times I explain my feelings, it seems like nobody can grasp the full extent of what I’ve been through.

So while I appreciate that people are trying to help, their efforts often just make me feel more isolated and misunderstood. The pain is too raw, and the sense of injustice too strong for anything to ease it right now.","","","",""
"d4253580160a","It sounds really tough going through these feelings of hurt and betrayal. Have you talked about how you’re feeling with someone who understands what you’ve been through? Sometimes finding the right person to talk to can make a big difference.","I have talked to a few close friends, but it doesn’t feel like they truly understand or that their words help much. They try to reassure me and offer support, but I still feel dismissed and misunderstood. It’s hard for them to really grasp how deeply this has affected me. And even when they do try to validate my feelings, I can't shake the sense of betrayal and anger. It feels like no matter what anyone says, it doesn’t change how hurt I am or how unfair it all seems.","","","",""
"e1dd00b74e86","It sounds incredibly difficult to take those first steps when the fear of being misunderstood is so strong. Maybe starting with very brief and informal interactions, like a short call just to see how it feels, could help ease into more substantial conversations.

Have you considered talking to someone who has gone through something similar? Sometimes connecting with people who truly understand can provide the validation and support you need without feeling exposed right away.","Talking to someone who has gone through something similar sounds like it might be helpful, but I’m still hesitant about opening up even that much. The fear of being misunderstood or dismissed is so strong that every step feels risky.

Starting with very brief and informal interactions, like a short call just to see how it feels, might help ease into more substantial conversations, but there’s this worry that no one will truly get what I’ve been through. How do you know if anyone can provide the support and understanding you need when everything else has felt so unfair?

It’s not easy to trust that expressing myself in any form will actually make a difference when every other attempt at support feels like another chance for disappointment. The pain and anger are so intense that they don’t fully dissipate with any form of expression.

I keep feeling this intense anger and hurt, and it’s tough to see a way forward without being let down yet again. How can anyone truly understand what I’ve been through or validate my feelings as deeply as they need to be validated?","","","",""
"6c0e823f32f5","It sounds incredibly tough to keep pushing through when the pain feels so constant and overwhelming. Even small moments of relief can make a difference, even if they don’t last long. Have you found any particular friends or activities that offer at least a brief respite from those feelings? Sometimes talking about it with someone who really listens can help, even if just for a little while.","I’ve tried reaching out to close friends and family, but it’s hard because their attempts to comfort me often feel like they’re not quite hitting the mark. They mean well, but sometimes their words just make me feel more dismissed or misunderstood. It’s frustrating because I know they care, but it’s tough when nothing seems to alleviate this deep sense of loss.

There are a few friends who listen without judgment, and talking with them can offer some temporary relief. But as soon as the conversation ends, the pain comes rushing back. Hobbies like reading or painting used to be comforting, but now they feel more like distractions that don’t address the core issue. It’s like trying to plug up a leaky dam with a Band-Aid—it just doesn’t work.

I’m grateful for your understanding and support here, though. It helps knowing there are people who can see how much this is affecting me, even if it doesn’t change anything in the moment. The pain feels so relentless, and it’s hard to find any lasting comfort or strength amidst all of this.","","","",""
"58167507b55c","You’re very welcome. Focusing on that positive shift is a great way to approach this. I’ll be here whenever you need to share updates or just talk things through. Wishing you clarity and validation in your consultations. Take care!","Thank you so much. Knowing that you’re here for support means a lot. I’ll definitely reach out with any updates or if I need to talk things through further. Here’s hoping these consultations bring some of the clarity and validation I’m looking for.

Take care too, and thanks again for everything.","","","",""
"f304ec8e332e","It sounds incredibly challenging, and it makes sense that you’re feeling very resistant to trying more options right now. Have you considered taking some time just for yourself, maybe focusing on activities that bring you a small amount of comfort or peace? Even if it’s just for a short while each day, these moments might help you feel a bit better.

Would you be open to trying any small self-care activities, even if they seem trivial?","Taking time for myself feels trivial when the pain is so deep and constant. Even if I try activities that bring me some comfort or peace, it’s hard to believe they will make much of a difference. Every time I sit down to do something like reading a book or going for a walk, all I see is the same message: I was let go while others stayed on, and that proves something negative about me.

It’s frustrating because nothing seems capable of changing how I feel—like no one sees my value or effort. Even small self-care activities won’t change that deep-seated belief. It feels pointless to try anything new when past attempts haven’t provided the relief I hoped for.","","","",""
"8154ec22dff2","You’re very welcome! Taking that first step is such an important part of moving forward, and I’m here to support you every step of the way. If anything comes up or if you need more help along the way, don’t hesitate to reach out. Wishing you all the best as you talk to your friends and take care of yourself.","Thank you so much for your continued support. Knowing that I have someone here who understands and cares makes a big difference. I’ll reach out to my friends later this week and see where it leads. If anything comes up or if I need more help, I’ll definitely let you know.

Wishing myself the best as well, and I appreciate your encouragement every step of the way. Take care!","","","",""
