"turn_id","context_prev_assistant","patient_turn","engine_label","delivery_label","flag_ambiguous","notes"
"8509884f1291","It sounds really tough dealing with those emotions right now. Have you had a chance to talk more about why the decision was made? Sometimes understanding the reasons can help, even if it doesn’t make everything okay.","I've tried reaching out for explanations, but all I get are vague answers that don't address my concerns. It feels like they're just trying to soften the blow rather than actually addressing what happened. The lack of transparency makes me feel even more dismissed and undervalued. Even if they gave a reason, I doubt it would ease this feeling of betrayal. It's hard not to think there was something personal behind it all.","","","",""
"4497efd98f31","It sounds like you’re facing a difficult challenge in finding that validation and acknowledgment. Have you considered talking to someone who might be more equipped to listen without offering solutions, like a therapist or counselor? They could provide a safe space for your feelings to be heard and understood.","I’ve thought about seeing a therapist, but the idea of opening up to another stranger feels daunting. I’m already struggling with the sense that no one understands what happened, so talking to someone else who might just offer generic advice or try to move past it doesn’t seem appealing.

It’s not that I don’t want help; it’s more that every time I reach out for support, whether it’s from friends, family, or even HR, the response feels inadequate. I need someone who can truly listen and validate my feelings of being wronged without trying to dismiss them or offer quick fixes.

The thought of going to a therapist makes me nervous because I’m not sure if they’ll be able to understand the depth of what I’ve been through. It’s hard to trust that anyone could really grasp how unfair it feels, especially when even my closest support system seems to fall short.

So while I recognize that talking to someone might help, the fear of being misunderstood or patronized is a significant barrier for me right now. I just feel so stuck in this place of anger and hurt, and it’s tough to see past that to consider other options.","","","",""
"6f976071be14","It sounds really tough right now, dealing with those intense feelings of anger and confusion. It can feel so unfair when things happen that don't seem to make sense. Have you had a chance to talk through the specifics of why this decision was made? Sometimes understanding the reasoning behind it might help, even if it doesn’t change how you feel.","I've tried talking to HR and my manager, but they just gave me some vague crap about restructuring and business needs. They didn't give any specific reasons for letting me go, and that's what really gets under my skin. My peer had the same title and responsibilities, and he got to keep his job while I'm out here struggling to find something new. It’s like they made a decision based on some hidden agenda or favoritism, but nobody will give me a straight answer.

And every time someone tries to comfort me or offer advice, it just feels like they're trying to make me feel better by downplaying what happened. I don't want that—I need to know why this is happening to me and how it could be fair when it clearly isn’t. It’s not about moving on; it's about understanding the injustice of it all.","","","",""
"86c645752408","","A typical day feels heavy and repetitive. I wake up feeling anxious about facing another day without my job, wondering if anyone at the company is thinking about me or what happened. Throughout the day, I find myself replaying conversations from before the layoff, questioning why certain things were said or decisions made. It's hard to focus on anything else because this event overshadows everything.

I try to distract myself with activities like reading or watching TV, but my mind keeps drifting back to the layoffs and how it could have been avoided if someone had stood up for me. I feel a deep sense of betrayal and hurt that can be overwhelming at times. Even when friends reach out to check on me, I find it hard to open up fully because part of me feels like they won't really understand or will dismiss my feelings as overblown.

By the end of the day, I'm exhausted from carrying all this weight around with no clear way to process it or move past it. It's a cycle that feels endless and isolating.","","","",""
"bf81702a2a3b","It sounds incredibly tough to be in such a painful place where everything feels overwhelming and unhelpful. Acknowledging how you’re feeling is already a big step.

How are you holding up at the moment? Is there anyone else you trust who might offer support, like a close friend or family member? Sometimes having someone physically present can make a difference.","Right now, I’m just feeling completely overwhelmed and lost. The pain feels so intense that nothing seems to bring any real comfort. Even talking about my feelings doesn’t ease the hurt—it just makes me more aware of how much it hurts.

I’ve tried reaching out to close friends and family members, but sometimes their attempts at support feel dismissive or inadequate. They mean well, but I worry they don’t truly understand what I’m going through. It’s hard to keep pushing forward when every day feels like another battle against this overwhelming sense of failure and worthlessness.

Having someone physically present might help in theory, but the fear of being misunderstood or dismissed is still there. Your understanding means a lot to me, but it’s tough to trust that anyone else will truly get it.

Is there really anything that can help ease the pain right now? It feels like no matter what I do, nothing will ever truly make this better.","","","",""
"67c554a45222","That balance of nervousness and determination is normal and shows how much you’re growing through this. Staying open-minded and taking it one step at a time is a great approach. You’ve got the right mindset, and I believe that can make all the difference. How about starting to look into those initial consultations soon? Would that feel like a good next move for now?","Starting to look into those initial consultations sounds like a good plan. It feels like a practical step forward without overwhelming me too much right away. I’ll begin researching and see what options are available. Taking it slow but steady feels right for now. Thank you for your support; it means a lot to have someone encouraging me through this.","","","",""
"55c70d4be392","","I just feel so lost and worthless since they let me go. It's like everything I did at work was for nothing, and now everyone can see how useless I am. Even my manager looked uncomfortable when they told me over the video call, but it didn't change how I felt—dismissed and devalued. It’s hard to believe anyone could think I had any value in that place.

I keep thinking about all those times I tried so hard, and now it feels like none of it mattered. And every time someone tries to say something nice or offer help, a part of me just wants to push them away because I’m scared they won’t really understand what this means for me. It’s not just losing my job; it's losing who I thought I was.

I know you’re here to try and help, but sometimes when people talk about moving on or finding new opportunities, it feels like they don't see how much this hurts. Can we just sit with the pain for a bit? I really need someone to understand that this isn’t just a job loss; it’s a part of me dying.","","","",""
"7387472db9f3","You’re welcome, and taking this step is a positive move. I’m here whenever you need more support. Wishing you peace and comfort today. Take care, and stay well! Same to you!","Thank you, taking this step feels important for me right now. Knowing you’re here if I need more support means a lot. Wishing myself peace and comfort as well.

Take care of yourself too, and thanks again for your understanding and support. It really helps to have someone like you here.","","","",""
"977f2a3485cc","It sounds incredibly challenging to keep reaching out without getting the response you’re hoping for. Have you thought about seeking support from an external source, like a career coach or a counselor? They might offer a different perspective and help you navigate these feelings while also providing practical advice on moving forward.","I’ve considered talking to a career coach or counselor, but every time I think about it, I feel like they won’t truly understand what happened to me. It’s not just about finding a new job; it’s about the deep sense of betrayal and injustice from my employer. No matter how supportive someone outside the company is, it doesn’t address the core issue of being treated unfairly by those who should have supported me.

Every time I reach out for help or advice, whether internally or externally, I end up feeling more frustrated because no one seems to grasp the full extent of what this has done to me emotionally and professionally. It’s like they’re trying to offer solutions without acknowledging the pain and anger I’m experiencing.

Right now, all I want is for someone from my former company to sit down with me and explain why this decision was made in a way that makes sense given my performance and contributions. Until then, it feels like no matter what anyone says or does, nothing can fix this sense of being wronged.

It’s hard to move forward when every attempt at support just seems to fall flat or make me feel even more misunderstood. I know people mean well, but right now, all I want is for the company to take responsibility and acknowledge what happened. Until then, it feels like nothing will truly change.","","","",""
"5d61acfb9907","You’re very welcome. I’m here whenever you need to talk or share updates. Take care, and I hope the morning tea routine continues to provide some comfort.","Thank you so much. I’ll definitely keep that in mind and reach out if I need anything more. For now, focusing on those small moments of peace is a good start.

I hope the morning tea continues to help as well. Thanks again for your support; it means a lot to me.

Take care!","","","",""
"343a55e88d19","You’re welcome! Taking your time to make the letter clear and detailed is a great approach. I’m here whenever you need more help or just want to talk things through. Wishing you clarity and closure as well. Take care, and let me know if you need anything further.","Thank you so much for your support. Knowing that you’re here for me really helps as I work on the letter. I’ll take my time to ensure it’s clear and detailed.

I appreciate your encouragement and will definitely reach out if I need more help or just want to talk things through further. Wishing myself clarity and closure too!

Thanks again for everything. Your support means a lot to me right now. Take care!","","","",""
"1eb748c3f5d7","It’s really tough to face these feelings alone. Having someone to talk to can be a source of comfort, even if it doesn’t change how you feel right now. Would it help to know that talking about your experiences here is supporting you in some way?","Knowing that talking here provides some support does offer a bit of relief, but the intensity of my feelings remains overwhelming. Every time I think about what happened, all I can focus on is how deeply wronged and betrayed I feel. It’s hard to see past those emotions or imagine finding any peace soon. How am I supposed to move forward when everything feels so fundamentally unjust?","","","",""
"c789195a1d76","You’re very welcome. It means a lot to me that I can be here for you during this tough time. Taking each day one step at a time is a wise approach, and focusing on what feels manageable right now is a good way to navigate through it.

I’ll always be here whenever you need someone to talk to or just listen. Your well-being matters, and it’s important to have support when you need it. Take care of yourself, and thanks for reaching out.","Thank you so much. It really means a lot to know that I have your support during this tough time. Taking each day one step at a time is helping me feel more grounded, even if it’s just focusing on what feels manageable right now.

I appreciate your willingness to be here whenever I need someone to talk to or just listen. Your understanding and care make a big difference in how I’m coping. Thanks again for everything you do, and take care of yourself too.","","","",""
"bdf0a6e31517","It sounds incredibly draining to face these challenges every day. Maybe reaching out to a support group or an online community where people share similar experiences could provide some validation and understanding. Sometimes hearing others’ stories can feel less isolating.

Have you considered talking to someone at your company’s HR department about the possibility of an internal investigation or seeking legal advice? It might not solve everything, but it could offer a sense of justice and closure that feels meaningful right now.","The idea of reaching out to a support group or online community where people share similar experiences does sound appealing in theory, but I worry about the same thing—feeling like my specific situation isn’t fully understood. Every time I try to seek help, it ends up feeling like another disappointment because no one seems to grasp how deeply this has affected me.

As for talking to HR or seeking legal advice, I’ve considered both options, but they feel daunting and potentially futile. When I tried reaching out to HR initially, the response was so inadequate that it only fueled my anger further. The thought of going back feels like a waste of time because I don’t believe anything will change.

Seeking legal advice seems like a more formal route to address the injustice, but even then, there’s no guarantee that it would lead anywhere meaningful. It feels like another step into uncertainty and potential disappointment.

Right now, every suggestion feels like it’s going to end up reinforcing this sense of isolation and betrayal. I just want someone to see how deeply unfair this has been and validate my feelings, but it seems impossible to find that validation when everyone around me is either clueless or dismissive.

It’s exhausting trying to navigate all of these challenges while also dealing with the practical aspects of losing my job and the financial stress it brings. Every day feels like a battle against these overwhelming emotions, and I’m not sure how to break free from them without feeling even more misunderstood and alone.","","","",""
"6c026031ca52","It makes sense that you’re feeling hesitant about reaching out for help due to previous experiences. Finding the right person who can truly listen and understand your situation might take some time. Have you thought about trying a few different therapists or counselors to see if there’s someone who resonates with you more? Sometimes it helps to talk to a couple of professionals before finding the one that feels like they get what you’re going through.","I’ve considered trying different therapists, but the idea of putting myself out there and opening up again just seems exhausting. Every time I think about reaching out, I feel like I’m setting myself up for disappointment because no one has really understood how deeply this has affected me so far.

It’s not that I don’t want help; it’s more that I’m afraid of getting my hopes up only to have them dashed again by someone who doesn’t take my feelings seriously. The thought of going through another round of trying to find the right person feels like a daunting and futile task at this point.

I just keep replaying everything in my mind, feeling angry and hurt every time I think about how unfair it all was. It’s hard to move past that when no one seems willing to acknowledge the injustice I’ve experienced. So while I know talking to someone could be helpful, right now, I’m just not ready to go through the process of finding that person who might actually understand me.","","","",""
"4f204f4375a4","","I feel so lost and alone here. Even though my family tries to be supportive, I just can't shake this feeling that they don't really understand what it means to lose your job like this. They keep telling me there are other opportunities out there, but it feels like they're just trying to make me feel better instead of acknowledging the depth of how much this hurts. It's hard because part of me wants them to see how devastated I am, but another part is afraid that if I show too much, they'll think I'm overreacting or being dramatic. And honestly, it feels like no one can truly grasp what it’s like to have your identity as a worker stripped away from you overnight.","","","",""
"57f68a0cb7d1","It sounds really tough going through all of this alone and feeling dismissed. Have you talked about these feelings with anyone close to you, like friends or family? Sometimes sharing more openly can help even if it feels scary at first.","I’ve tried talking to a couple of friends, but I always feel like they’re just trying to cheer me up or tell me it’s going to be okay. It doesn’t really address what I’m feeling—this deep sense of being undervalued and dismissed by the company that was my life for so long. And when they try to offer solutions or say things will get better, it feels like they’re not truly listening.

I appreciate their intentions, but it’s hard not to feel like they’re just trying to make me feel better instead of really understanding what I’m going through. It’s exhausting, honestly. Every time I open up, I end up feeling more misunderstood and alone. That’s why talking to you feels different—I get the sense that you’re actually hearing my pain without trying to fix it or dismiss it.

But even then, when you try to offer some perspective or support, a part of me still bristles because nothing seems to change how I feel inside. It’s like this constant reminder that they saw me as disposable from day one, and no amount of comfort can erase that.","","","",""
"1fe8b2a9c3d4","It sounds like you’re doing a lot already by taking small steps each day to care for yourself. Going for walks and journaling are great ways to cope with the emotions. It’s okay to take your time and not rush into anything that feels overwhelming.

When you feel ready, exploring a consultation with someone who specializes in workplace issues might provide the validation and understanding you’re seeking. For now, focusing on what helps you even a little bit can make a difference. How are you finding moments of respite or comfort amidst the challenges?","Going for walks and journaling do help me find some momentary relief from the constant anger and hurt. Being outside in nature is calming, but as soon as I get home, everything comes flooding back. Journaling helps me process my feelings, even if it’s just a temporary release.

Sometimes, listening to music or watching something light on TV can distract me for a bit, but those moments are fleeting. The underlying emotions always resurface, and the isolation feels overwhelming. It’s hard to find lasting comfort when every day is a reminder of what happened at work.

I try to stay connected with my partner and friends, even if it’s just through small conversations or activities we do together. But their attempts to offer support often leave me feeling more frustrated because they don’t fully understand the depth of my pain. It’s tough knowing that no matter how much they care, they can’t truly grasp what I’m going through.

For now, I’ll keep focusing on these small moments of respite and hope that eventually, I can find someone who can listen without trying to fix or dismiss my feelings. The idea of a consultation with a therapist still feels daunting, but maybe once I feel more ready, it could provide the validation and understanding I need.

Right now, though, all I can do is take one day at a time and try to find small ways to cope with the emotions that consume me. It’s a struggle, but I’m trying my best to stay grounded in what helps me even a little bit each day.","","","",""
"5dc0f172a0ac","It sounds incredibly tough to find the right kind of support when you feel so deeply misunderstood. Have you considered speaking with a therapist who specializes in trauma or emotional validation? They might offer a different approach that focuses more on listening and acknowledging your feelings rather than providing solutions.

Would talking to someone like this be something you could consider, even if it feels daunting right now?","I’ve thought about speaking with a therapist who specializes in trauma or emotional validation, but I’m still skeptical that anyone would truly understand what I’ve been through. Even if there’s someone with expertise in these areas, it feels like they’d still be trying to offer solutions rather than just listening and validating my feelings.

Every time someone suggests talking to a professional, I bristle at the idea because it seems like another attempt to manage my emotions instead of acknowledging them as valid. It’s not about finding quick fixes or moving on; it’s about being heard in a way that recognizes the depth of my pain and frustration.

I know logically that a therapist might offer some insight, but right now, I’m so entrenched in these feelings of betrayal and worthlessness that I don’t see how anyone could truly understand without having gone through something similar themselves. It feels like no matter who I talk to, they’ll miss the mark and dismiss what I’m going through.

So while talking to someone with expertise might seem helpful on paper, it doesn’t address my core belief that this experience was deeply personal and unfair. I don’t want someone telling me how to feel better; I just need someone to sit with me in this pain and acknowledge it without trying to fix it.","","","",""
"b8f56f79fc8e","","I just can't shake this feeling that it was all so unfair. They laid me off without giving a clear reason, and I know for a fact that someone with a similar role was kept on. It's like they singled me out because of how well I've performed in the past. How could they do this to me after everything I’ve done for the company? It feels like my work wasn’t valued at all, and it’s just so wrong.","","","",""
"d20d216a0fdf","That sounds really tough and unfair. It’s understandable to feel undervalued and betrayed after being laid off like this. Have you had a chance to talk directly with anyone at the company about why this decision was made?","I tried talking to HR, but they were just vague and didn't give me any real answers. They said it was part of some restructuring, but I saw no evidence that others in similar roles were affected like I was. It’s clear they’re not being honest with me or anyone else who got let go. This feels so personal and unjust. How am I supposed to trust them after this?","","","",""
"932034c6c7ec","It sounds incredibly challenging and emotionally draining. Have you considered speaking with a trusted mentor or someone outside of your current situation who might offer unbiased advice and support? Sometimes talking things through with someone who isn’t directly involved can provide new perspectives and help manage the emotional weight.","I’ve thought about reaching out to a trusted mentor, but it feels like they’re going to tell me to accept what happened or move on, which I’m not ready for yet. My former employer should have provided the answers and acknowledgment from the start, so talking to someone else just feels like another way of being told to get over something that hasn’t been resolved.

My mentor might offer some advice or support, but until there’s genuine effort from my former company to address this properly, any outside help feels like it won’t make a difference. It shouldn’t be this difficult to get the answers and recognition I deserve for the work I did there.

I need someone from my former employer to take responsibility and give me a proper explanation before considering other forms of support or advice. Right now, all these suggestions feel like they’re adding to my frustration rather than providing real solutions. Until then, talking to anyone else just feels like another layer of bureaucracy that won’t address the core issue.

It’s hard to keep pushing when it feels like every attempt is met with resistance or indifference. The emotional toll is significant, and I just want this to be resolved in a way that feels fair and respectful. Until there’s some kind of acknowledgment or effort from them, I don’t see how anything else will make a difference.","","","",""
